[
  {
    "id": "MATH",
    "parent_id": null,
    "title": "Mathematics",
    "definition": "Abstract structures, spaces, quantities and transformations.",
    "boundary": "Formal questions; applications cross-link to their model domain.",
    "objects": [
      "groups",
      "manifolds",
      "equations",
      "graphs"
    ],
    "related_ids": [],
    "classification_source_ids": [
      "SRC-BASE-001",
      "SRC-BASE-015"
    ],
    "external_mapping": {
      "relation": "inspired_by",
      "exact_equivalence": false
    },
    "disposition": "include_task_screened",
    "rationale": "Retain theoretical research tasks; decide experimental and resource requirements per problem.",
    "methods": [
      "proof",
      "model_analysis"
    ],
    "validation_options": [
      "pure_proof",
      "exact_computation",
      "numerical_evidence",
      "public_data"
    ],
    "coverage_note": "A navigation umbrella, not a claim that all constituent research has been surveyed."
  },
  {
    "id": "LOGIC",
    "parent_id": null,
    "title": "Logic and foundations",
    "definition": "Formal reasoning, definability and foundational systems.",
    "boundary": "Metamathematical claims specify their ambient logic and axioms.",
    "objects": [
      "theories",
      "proofs",
      "models",
      "types"
    ],
    "related_ids": [],
    "classification_source_ids": [
      "SRC-BASE-001",
      "SRC-BASE-015"
    ],
    "external_mapping": {
      "relation": "inspired_by",
      "exact_equivalence": false
    },
    "disposition": "include_task_screened",
    "rationale": "Retain theoretical research tasks; decide experimental and resource requirements per problem.",
    "methods": [
      "proof",
      "model_analysis"
    ],
    "validation_options": [
      "pure_proof",
      "exact_computation",
      "numerical_evidence",
      "public_data"
    ],
    "coverage_note": "A navigation umbrella, not a claim that all constituent research has been surveyed."
  },
  {
    "id": "CS",
    "parent_id": null,
    "title": "Theoretical computer science",
    "definition": "Possibility, cost and correctness of computation.",
    "boundary": "Deployment engineering is outside scope unless it yields a formal research question.",
    "objects": [
      "algorithms",
      "circuits",
      "protocols"
    ],
    "related_ids": [],
    "classification_source_ids": [
      "SRC-BASE-005",
      "SRC-FORMAL-001"
    ],
    "external_mapping": {
      "relation": "inspired_by",
      "exact_equivalence": false
    },
    "disposition": "include_task_screened",
    "rationale": "Retain theoretical research tasks; decide experimental and resource requirements per problem.",
    "methods": [
      "proof",
      "model_analysis"
    ],
    "validation_options": [
      "pure_proof",
      "exact_computation",
      "numerical_evidence",
      "public_data"
    ],
    "coverage_note": "A navigation umbrella, not a claim that all constituent research has been surveyed."
  },
  {
    "id": "PROB",
    "parent_id": null,
    "title": "Probability theory",
    "definition": "Mathematical laws of random objects and processes.",
    "boundary": "Distributional assumptions are distinct from empirical fit.",
    "objects": [
      "random walks",
      "measures",
      "percolation"
    ],
    "related_ids": [],
    "classification_source_ids": [
      "SRC-BASE-005"
    ],
    "external_mapping": {
      "relation": "inspired_by",
      "exact_equivalence": false
    },
    "disposition": "include_task_screened",
    "rationale": "Retain theoretical research tasks; decide experimental and resource requirements per problem.",
    "methods": [
      "proof",
      "model_analysis"
    ],
    "validation_options": [
      "pure_proof",
      "exact_computation",
      "numerical_evidence",
      "public_data"
    ],
    "coverage_note": "A navigation umbrella, not a claim that all constituent research has been surveyed."
  },
  {
    "id": "STAT",
    "parent_id": null,
    "title": "Statistical and learning theory",
    "definition": "Guarantees for inference, decisions and learning from observations.",
    "boundary": "Benchmarks alone do not establish general statistical guarantees.",
    "objects": [
      "estimators",
      "tests",
      "risk",
      "identifiability"
    ],
    "related_ids": [],
    "classification_source_ids": [
      "SRC-BASE-005"
    ],
    "external_mapping": {
      "relation": "inspired_by",
      "exact_equivalence": false
    },
    "disposition": "include_task_screened",
    "rationale": "Retain theoretical research tasks; decide experimental and resource requirements per problem.",
    "methods": [
      "proof",
      "model_analysis"
    ],
    "validation_options": [
      "pure_proof",
      "exact_computation",
      "numerical_evidence",
      "public_data"
    ],
    "coverage_note": "A navigation umbrella, not a claim that all constituent research has been surveyed."
  },
  {
    "id": "INFO",
    "parent_id": null,
    "title": "Information and coding theory",
    "definition": "Limits of communication, representation and information processing.",
    "boundary": "Physical implementations link to physics and engineering.",
    "objects": [
      "channels",
      "codes",
      "entropy regions"
    ],
    "related_ids": [],
    "classification_source_ids": [
      "SRC-BASE-005"
    ],
    "external_mapping": {
      "relation": "inspired_by",
      "exact_equivalence": false
    },
    "disposition": "include_task_screened",
    "rationale": "Retain theoretical research tasks; decide experimental and resource requirements per problem.",
    "methods": [
      "proof",
      "model_analysis"
    ],
    "validation_options": [
      "pure_proof",
      "exact_computation",
      "numerical_evidence",
      "public_data"
    ],
    "coverage_note": "A navigation umbrella, not a claim that all constituent research has been surveyed."
  },
  {
    "id": "PHYS",
    "parent_id": null,
    "title": "Theoretical physics",
    "definition": "Mathematical models and principles proposed for physical systems.",
    "boundary": "Derivation under assumptions is separate from empirical confirmation.",
    "objects": [
      "fields",
      "matter",
      "spacetime",
      "particles"
    ],
    "related_ids": [],
    "classification_source_ids": [
      "SRC-BASE-002"
    ],
    "external_mapping": {
      "relation": "inspired_by",
      "exact_equivalence": false
    },
    "disposition": "include_task_screened",
    "rationale": "Retain theoretical research tasks; decide experimental and resource requirements per problem.",
    "methods": [
      "proof",
      "model_analysis"
    ],
    "validation_options": [
      "pure_proof",
      "exact_computation",
      "numerical_evidence",
      "public_data",
      "simple_experiment",
      "complex_experiment"
    ],
    "coverage_note": "A navigation umbrella, not a claim that all constituent research has been surveyed."
  },
  {
    "id": "MPHY",
    "parent_id": null,
    "title": "Mathematical physics",
    "definition": "Rigorous analysis of structures and models motivated by physics.",
    "boundary": "Primary placement follows the theorem target; physics relevance is cross-linked.",
    "objects": [
      "operators",
      "measures",
      "Hamiltonians"
    ],
    "related_ids": [],
    "classification_source_ids": [
      "SRC-BASE-002"
    ],
    "external_mapping": {
      "relation": "inspired_by",
      "exact_equivalence": false
    },
    "disposition": "include_task_screened",
    "rationale": "Retain theoretical research tasks; decide experimental and resource requirements per problem.",
    "methods": [
      "proof",
      "model_analysis"
    ],
    "validation_options": [
      "pure_proof",
      "exact_computation",
      "numerical_evidence",
      "public_data"
    ],
    "coverage_note": "A navigation umbrella, not a claim that all constituent research has been surveyed."
  },
  {
    "id": "CHEM",
    "parent_id": null,
    "title": "Theoretical chemistry and materials",
    "definition": "Models of molecular structure, reactions and material behavior.",
    "boundary": "A model calculation cannot certify a real compound or reaction without evidence.",
    "objects": [
      "electronic states",
      "reaction networks",
      "lattices"
    ],
    "related_ids": [],
    "classification_source_ids": [
      "SRC-BASE-003"
    ],
    "external_mapping": {
      "relation": "inspired_by",
      "exact_equivalence": false
    },
    "disposition": "include_task_screened",
    "rationale": "Retain theoretical research tasks; decide experimental and resource requirements per problem.",
    "methods": [
      "proof",
      "model_analysis"
    ],
    "validation_options": [
      "pure_proof",
      "exact_computation",
      "numerical_evidence",
      "public_data",
      "simple_experiment",
      "complex_experiment"
    ],
    "coverage_note": "A navigation umbrella, not a claim that all constituent research has been surveyed."
  },
  {
    "id": "BIO",
    "parent_id": null,
    "title": "Theoretical biology",
    "definition": "Formal models of living systems across scales.",
    "boundary": "Biological realism and empirical identification require separate review.",
    "objects": [
      "populations",
      "cells",
      "networks",
      "sequences"
    ],
    "related_ids": [],
    "classification_source_ids": [
      "SRC-BASE-005"
    ],
    "external_mapping": {
      "relation": "inspired_by",
      "exact_equivalence": false
    },
    "disposition": "include_task_screened",
    "rationale": "Retain theoretical research tasks; decide experimental and resource requirements per problem.",
    "methods": [
      "proof",
      "model_analysis"
    ],
    "validation_options": [
      "pure_proof",
      "exact_computation",
      "numerical_evidence",
      "public_data",
      "simple_experiment",